{
  "$schema": "./schema.json",
  "domain": "fullstack",
  "keywords": [
    "javascript",
    "typescript",
    "node.js",
    "react",
    "next.js",
    "sql/mysql",
    "mongodb",
    "rest api",
    "php",
    "python",
    "full stack",
    "fullstack",
    "end-to-end",
    "front-end",
    "back-end",
    "api integration",
    "database",
    "html",
    "css",
    "wordpress"
  ],
  "facet_types": [
    "language",
    "framework",
    "tool",
    "practice",
    "platform"
  ],
  "highlights": [
    "End-to-end feature ownership; database to API to UI, with holistic optimization across the full stack.",
    "Modern JavaScript and PHP ecosystems; server-side and client-side delivery with shared tooling.",
    "Database design and optimization; schema modeling, migrations, query optimization, and caching.",
    "API design and integration; RESTful endpoints, third-party SaaS integrations, and webhooks.",
    "DevOps and deployment; containerization, CI/CD pipelines, monitoring, and horizontal scaling.",
    "Testing across layers; unit, integration, and E2E coverage for full-stack delivery confidence."
  ]
}