{
  "$schema": "./schema.json",
  "domain": "frontend",
  "keywords": [
    "react",
    "angular",
    "vue",
    "html5",
    "css/sass",
    "typescript",
    "webpack",
    "next.js",
    "javascript",
    "tailwind",
    "bootstrap",
    "figma",
    "responsive design",
    "accessibility",
    "wcag",
    "css",
    "ui",
    "ux",
    "component library"
  ],
  "facet_types": [
    "language",
    "framework",
    "tool",
    "practice"
  ],
  "highlights": [
    "Component-driven UI architecture; reusable, accessible, and testable React and vanilla JS components.",
    "State management and data flow; predictable patterns for complex client-side application state.",
    "Performance optimization; code splitting, lazy loading, bundle analysis, and Core Web Vitals.",
    "Responsive and accessible design; CSS Grid/Flexbox, WCAG compliance, and mobile-first development.",
    "Build tooling and bundling; Webpack and modern asset pipelines for production-ready delivery.",
    "Testing and QA; Jest, Cypress, end-to-end test coverage, and visual regression validation."
  ]
}