{
  "$schema": "./schema.json",
  "domain": "database",
  "keywords": [
    "sql",
    "mysql",
    "postgresql",
    "mongodb",
    "elasticsearch",
    "redis",
    "cassandra",
    "database",
    "sql/mysql",
    "mariadb",
    "query optimization",
    "indexing",
    "schema design",
    "etl",
    "replication",
    "backup",
    "data modeling",
    "orm",
    "migrations"
  ],
  "facet_types": [
    "tool",
    "language",
    "practice",
    "platform"
  ],
  "highlights": [
    "Relational database design; schema modeling, normalization, indexes, and integrity constraints.",
    "Query optimization and performance; execution plans, indexing strategies, and query tuning.",
    "NoSQL expertise; document stores, key-value, and time-series DBs with appropriate trade-offs.",
    "Replication and high availability; clustering, failover, backup strategies, and disaster recovery.",
    "Database administration; user management, security hardening, monitoring, and version upgrades.",
    "ETL and data pipelines; data loading, transformation, and integration across heterogeneous systems."
  ]
}