{
  "domain": "ai",
  "keywords": [
    "python",
    "tensorflow",
    "pytorch",
    "scikit-learn",
    "pandas",
    "jupyter",
    "data science",
    "machine learning",
    "llm",
    "nlp",
    "embeddings",
    "vector database",
    "openai",
    "hugging face",
    "rag",
    "prompt engineering",
    "fine-tuning",
    "data pipeline",
    "feature engineering",
    "model training"
  ],
  "facet_types": [
    "language",
    "framework",
    "tool",
    "practice",
    "strategic_domain"
  ],
  "highlights": [
    "Model training and evaluation; hyperparameter tuning, cross-validation, and performance metrics.",
    "Feature engineering and preprocessing; data pipelines, normalization, and dimensionality reduction.",
    "LLM integration and prompt engineering; RAG pipelines, embeddings, and vector database retrieval.",
    "Data analysis and visualization; pandas, exploratory analysis, and actionable insight generation.",
    "MLOps and production readiness; model versioning, A/B testing, monitoring, and retraining pipelines.",
    "Statistical rigor; hypothesis testing, experiment design, and statistical significance validation."
  ]
}